[
  {
    "id": "routellm-router-adapter",
    "owner": "codex",
    "priority": 1,
    "title": "Integrate RouteLLM routing adapter into autonomy runtime",
    "description": "Add RouteLLM-aware routing hooks in manager/runner with deterministic fallback behavior and explicit configuration surfaces for cost-aware model routing.",
    "depends_on": [],
    "acceptance": [
      "RouteLLM integration path is configurable and optional",
      "Fallback behavior is deterministic when router is unavailable",
      "Runner/manager unit tests cover routing decision paths"
    ]
  },
  {
    "id": "routellm-routing-adversarial-tests",
    "owner": "gemini",
    "priority": 2,
    "title": "Add independent adversarial tests for routing correctness",
    "description": "Create independent tests for model-routing correctness under latency spikes, quota pressure, and malformed router responses.",
    "depends_on": [
      "routellm-router-adapter"
    ],
    "acceptance": [
      "Tests cover router timeout, fallback, and malformed payload handling",
      "At least one test demonstrates regression protection for incorrect route selection",
      "Validation commands pass and evidence is recorded"
    ]
  },
  {
    "id": "npv-capacity-allocation-engine",
    "owner": "codex",
    "priority": 3,
    "title": "Implement NPV-based capacity allocation policy",
    "description": "Implement economic policy that decides when to scale lanes/subagents by expected marginal NPV relative to projected model and execution costs.",
    "depends_on": [
      "routellm-router-adapter"
    ],
    "acceptance": [
      "Policy computes marginal NPV with configurable assumptions",
      "Scaling decisions honor budget ceilings and safety limits",
      "Telemetry captures decision rationale and cost/value inputs"
    ]
  },
  {
    "id": "npv-policy-independent-tests",
    "owner": "gemini",
    "priority": 4,
    "title": "Add independent policy tests for NPV gates",
    "description": "Build tests that challenge economic policy assumptions including false-positive scale-ups, budget exhaustion, and uncertainty penalties.",
    "depends_on": [
      "npv-capacity-allocation-engine"
    ],
    "acceptance": [
      "Tests assert no scale-up when marginal NPV is negative",
      "Tests assert correct guardrails under budget and concurrency limits",
      "Validation commands pass and findings are documented"
    ]
  },
  {
    "id": "autonomy-lane-subagent-scaling",
    "owner": "codex",
    "priority": 5,
    "title": "Wire lane/subagent scaling controls into supervisor operations",
    "description": "Integrate approved NPV decisions into lane start/ensure logic for controlled parallelism increases with rollback safety.",
    "depends_on": [
      "npv-capacity-allocation-engine"
    ],
    "acceptance": [
      "Lane scaling controls are gated and reversible",
      "Scale-up and scale-down events are observable in status/dashboard outputs",
      "No regression in existing lane orchestration behavior"
    ]
  },
  {
    "id": "routing-economics-release-readiness",
    "owner": "codex",
    "priority": 6,
    "title": "Finalize release readiness for routing economics profile",
    "description": "Complete docs, runbooks, and evidence artifacts proving cost/performance gains and safe autonomy operation.",
    "depends_on": [
      "routellm-routing-adversarial-tests",
      "npv-policy-independent-tests",
      "autonomy-lane-subagent-scaling"
    ],
    "acceptance": [
      "Runbook documents activation, rollback, and stop-loss policy",
      "Validation and metrics evidence is committed under governance standards",
      "Repository passes required quality gates"
    ]
  }
]
