[
  {
    "id": "architecture-security-ethics-review",
    "owner": "codex",
    "priority": 1,
    "title": "Perform architecture, security, and ethics hardening review",
    "description": "Review governance, CI controls, security docs, and operational safety boundaries for autonomous collaboration and produce actionable improvements.",
    "depends_on": [],
    "acceptance": [
      "Findings are translated into concrete code/doc updates",
      "Security and ethics controls are explicit and testable",
      "Validation commands pass in the implementation repo"
    ]
  }
]
